{"@context":["https://www.w3.org/ns/credentials/v2","https://purl.imsglobal.org/spec/ob/v3p0/context-3.0.3.json"],"id":"urn:uuid:83e1b31f-82ce-4492-8276-cb630415ca93","type":["VerifiableCredential","OpenBadgeCredential"],"name":"SkillCred persistence recovery test 20261010T201934Z","issuer":{"id":"did:key:z6MktmPmK6AoaieCguVRMorrL2b16gEJgJqreTaJRWBWR37s","type":["Profile"],"name":"SkillCred Pilot Issuer"},"validFrom":"2026-10-10T20:19:36Z","credentialSubject":{"id":"urn:skillcred:recovery-test:20261010T201934Z","type":["AchievementSubject"],"achievement":{"id":"urn:uuid:85265912-8625-48ec-bc68-9f0faff3c69a","type":["Achievement"],"name":"SkillCred persistence recovery test 20261010T201934Z","description":"Synthetic deployment acceptance credential used only to check persistent issuer key and revocation state after restart. No real participant data."}},"credentialStatus":{"id":"https://skillcred-pilot-api.onrender.com/status-list#1","type":"BitstringStatusListEntry","statusPurpose":"revocation","statusListIndex":"1","statusListCredential":"https://skillcred-pilot-api.onrender.com/status-list"},"proof":{"@context":["https://www.w3.org/ns/credentials/v2","https://purl.imsglobal.org/spec/ob/v3p0/context-3.0.3.json"],"type":"DataIntegrityProof","cryptosuite":"eddsa-jcs-2022","created":"2026-10-10T20:19:36Z","verificationMethod":"did:key:z6MktmPmK6AoaieCguVRMorrL2b16gEJgJqreTaJRWBWR37s#z6MktmPmK6AoaieCguVRMorrL2b16gEJgJqreTaJRWBWR37s","proofPurpose":"assertionMethod","proofValue":"zMzghogbBCtLi6oohPz2fcvi59mJa1CHu4xo8L5D8A3SQEd5ykuNAYoQB4ej4txHDPN5GVacWqucg1XHA4LK5p3X"}}