{"@context":["https://www.w3.org/ns/credentials/v2","https://purl.imsglobal.org/spec/ob/v3p0/context-3.0.3.json"],"id":"urn:uuid:77917889-2183-4282-a907-6f105e1b957b","type":["VerifiableCredential","OpenBadgeCredential"],"name":"SkillCred public deployment smoke test","issuer":{"id":"did:key:z6MktmPmK6AoaieCguVRMorrL2b16gEJgJqreTaJRWBWR37s","type":["Profile"],"name":"SkillCred Pilot Issuer"},"validFrom":"2026-10-10T20:08:43Z","credentialSubject":{"id":"urn:skillcred:deployment-smoke-test","type":["AchievementSubject"],"achievement":{"id":"urn:uuid:4308f6e7-3d3f-48b9-a864-f81a83cc6acb","type":["Achievement"],"name":"SkillCred public deployment smoke test","description":"Synthetic deployment acceptance credential. No real participant data."}},"credentialStatus":{"id":"https://skillcred-pilot-api.onrender.com/status-list#0","type":"BitstringStatusListEntry","statusPurpose":"revocation","statusListIndex":"0","statusListCredential":"https://skillcred-pilot-api.onrender.com/status-list"},"proof":{"@context":["https://www.w3.org/ns/credentials/v2","https://purl.imsglobal.org/spec/ob/v3p0/context-3.0.3.json"],"type":"DataIntegrityProof","cryptosuite":"eddsa-jcs-2022","created":"2026-10-10T20:08:43Z","verificationMethod":"did:key:z6MktmPmK6AoaieCguVRMorrL2b16gEJgJqreTaJRWBWR37s#z6MktmPmK6AoaieCguVRMorrL2b16gEJgJqreTaJRWBWR37s","proofPurpose":"assertionMethod","proofValue":"z4QwTGmU6fNEZGWb1oFdYa179zG8VRWqYf6wGiYLKqdFBRhqfdJtwTrSQw8fr9XDZZSiVvisz2EtfNmEXEtrU1Exf"}}